{"captured_at":"2026-10-01T08:00:00Z","case_id":"demo-case-001","generator":{"software":"oev-demo-generator","version":"0.2.0"},"notes":["Synthetic snapshot for demonstration purposes."],"parameters":{"max_days_since_service":180,"pressure_readings_required_for_agreement":2},"protocol_version":"oev-decision-pack/0.2","snapshot_id":"snapshot-2026-10-01-001","sources":[{"digest":"sha256:13f59794a5d5e6b955a633ccda5195147237d63bbccdeea4152206fd9a89c53b","kind":"sensor_export","retrieved_at":"2026-10-01T08:00:00Z","source_id":"sensor-export-2026-10-01"},{"digest":"sha256:53fb02729df8ed6c6a13564095ccc2c66673d9b66724fb69e5ded041914e7582","kind":"policy_document","retrieved_at":"2026-10-01T08:00:00Z","source_id":"policy-snapshot-2026-10-01"}]}